Reference Title,Title,Source Type,AP/TS,Name,AKA,Definition,Code Example,Causes / Effects,Frequency
https://dl.acm.org/doi/10.1145/3474624.3477066,Handling Test Smells in Python: Results from a Mixed-Method Study,paper,Test Smell,Sensitive Equality,,Use toString method in a test method to make validations,FALSO,FALSO,FALSO
https://dl.acm.org/doi/10.1145/2897010.2897016,On the diffusion of test smells in automatically generated test code: an empirical study,paper,Test Smell,Sensitive Equality,,"When an assertion contains an equality checks through the use of the toString method, the test is affected by a Sensitive Equality smell. In this case, the failure of a test case can depend on the details of the string used in the comparison, e.g., commas, quotes, spaces etc",FALSO,FALSO,FALSO
https://ieeexplore.ieee.org/document/9463091,"On the Distribution of ""Simple Stupid Bugs"" in Unit Test Files: An Exploratory Study",paper,Test Smell,Sensitive Equality,,A test method invokes the toString() method of an object,FALSO,FALSO,FALSO
https://dl.acm.org/doi/10.5555/3370272.3370293,On the distribution of test smells in open source Android applications: an exploratory study,paper,Test Smell,Sensitive Equality,,Occurs when the toString method is used within a test method.,FALSO,FALSO,VERDADEIRO
https://dl.acm.org/doi/10.1145/3350768.3350775,On the influence of Test Smells on Test Coverage,paper,Test Smell,Sensitive Equality,,"Occurs in test methods that contain an equality check using the method toString, which depends on details, such as commas and spaces. Thus, when the method for an object is changed, the test can fail;",FALSO,FALSO,FALSO
https://link.springer.com/chapter/10.1007/978-3-540-76440-3_8,On the interplay between software testing and evolution and its effect on program comprehension,article,Test Smell,Sensitive Equality,,"It is fast and easy to write equality checks using the toString method. A typical way is to compute an actual result,map it to a string, which is then compared to a string literal representing the expected value. Such tests, howevermay depend on many irrelevant details such as commas, quotes, spaces, etc.Whenever the toString method for an object is changed, tests start failing.",FALSO,VERDADEIRO,FALSO
https://ieeexplore.ieee.org/document/8529832,On the Relation of Test Smells to Software Code Quality,paper,Test Smell,Sensitive Equality,,A test using the ‘toString’ method directly in assert statements,FALSO,FALSO,FALSO
https://dl.acm.org/doi/abs/10.1145/3482909.3482916,On the use of test smells for prediction of flaky tests,paper,Test Smell,Sensitive Equality,,A test method that invokes the toString() method of an object.,FALSO,VERDADEIRO,VERDADEIRO
https://citeseerx.ist.psu.edu/viewdoc/download?doi=10.1.1.19.5499&rep=rep1&type=pdf,Refactoring Test Code,paper,Test Smell,Sensitive Equality,,"It is fast and easy to write equality checks using the toString method. A typical way is to compute an actual result, map it to a string, which is then compared to a string literal representing the expected value. Such tests, however may depend on many irrelevant details such as commas, quotes, spaces, etc. Whenever the toString method for an object is changed, tests start failing",FALSO,VERDADEIRO,FALSO
https://www.sciencedirect.com/science/article/pii/S0164121219301487?casa_token=UT0EMFzxTcQAAAAA:L9J82_15tdySkabcIMSHKPx8rVkrltOzcwgme5cIBWgT0txJENY5y-BdUmCYUoGHnoEjZJH-cYc,Scented since the beginning: On the diffuseness of test smells in automatically generated test code,article,Test Smell,Sensitive Equality,,"When an assertion contains an equality check through the use of the toString method, the test is affected by a Sensitive Equality smell. In this case, the failure of a test case can depend on the details of the string used in the comparison, e.g., commas, quotes, spaces etc.",FALSO,FALSO,FALSO
https://dl.acm.org/doi/10.1145/3337932.3338815,SoCRATES: Scala radar for test smells,paper,Test Smell,Sensitive Equality,,"A test case with an assertion that compares the state of objects by means of their textual representation, i.e., by means of the result of toString(). This makes the test vulnerable to small, and irrelevant details (e.g., spaces).",FALSO,FALSO,FALSO
https://dl.acm.org/doi/10.1145/3463274.3463335,Test Smell Detection Tools: A Systematic Mapping Study,paper,Test Smell,Sensitive Equality,,Occurs when an assertion has an equality check by using the toString method.,FALSO,FALSO,FALSO
https://citeseerx.ist.psu.edu/viewdoc/download?doi=10.1.1.649.6409&rep=rep1&type=pdf,TestQ: Exploring Structural and Maintenance Characteristics of Unit Test Suites,paper,Test Smell,Sensitive Equality,,Verification by dumping an object's characteristics to string.,FALSO,FALSO,FALSO
https://link.springer.com/article/10.1007/s10664-021-09969-1,The secret life of test smells-an empirical study on test smell evolution and maintenance,article,Test Smell,Sensitive Equality,,A test using the toString method for equality check in assert statements. The test case is sensitive to the implementation of toString,FALSO,FALSO,VERDADEIRO
https://dl.acm.org/doi/10.1145/3472674.3473981,Toward static test flakiness prediction: a feasibility study,paper,Test Smell,Sensitive Equality,,When the toString method is used within a test method.,FALSO,FALSO,VERDADEIRO
https://dibt.unimol.it/staff/fpalomba/documents/C14.pdf,Towards Automated Tools for Detecting Test Smells: An Empirical Investigation into the Nature of Test Smells,technical paper/manuscript,Test Smell,Sensitive Equality,,"When an assertion contains an equality check through the use of the toString method, the test is affected by a Sensitive Equality smell.",FALSO,VERDADEIRO,VERDADEIRO
https://dl.acm.org/doi/10.1145/3368089.3417921,tsDetect: an open source test smells detection tool,paper,Test Smell,Sensitive Equality,,A test method invokes the toString() method of an object,FALSO,FALSO,FALSO
https://www.proquest.com/openview/17433ac63caf619abb410e441e6557f0/1?pq-origsite=gscholar&cbl=18750,What the Smell? An Empirical Investigation on the Distribution and Severity of Test Smells in Open Source Android Applications,thesis,Test Smell,Sensitive Equality,,Occurs when the toString method is used within a test method.,FALSO,FALSO,VERDADEIRO
https://www.sciencedirect.com/science/article/pii/S0164121221000364,Why do builds fail?—A conceptual replication study,article,Test Smell,Sensitive Equality,,JUnit classes having at least one assert statement invoking a toString method.,FALSO,FALSO,FALSO
https://books.google.com.br/books?hl=pt-BR&lr=&id=-izOiCEIABQC&oi=fnd&pg=PT19&dq=%22test+code%22+AND+(%22test*+smell*%22+OR+antipattern*+OR+%22poor+quality%22)&ots=YL71coYZkx&sig=s3U1TNqypvSAzSilSbex5lnHonk#v=onepage&q=%22test%20code%22%20AND%20(%22test*%20smell*%22%20OR%20antipattern*%20OR%20%22poor%20quality%22)&f=false,xUnit test patterns: Refactoring test code,book,Test Smell,Sensitive Equality,,Objects to be verified are converted to strings and compared with an expected string.,FALSO,VERDADEIRO,FALSO
https://orbilu.uni.lu/handle/10993/48254,On the Maintenance of System User Interactive Tests,thesis,Test Smell,Sensitive Locators,,The test uses element identification selectors that have long chains to identify an element in the user interface. e.g. complex x-pass or CSS selector for web application.,FALSO,VERDADEIRO,VERDADEIRO
https://arxiv.org/abs/2111.02317,Smells in System User Interactive Tests,technical paper/manuscript,Test Smell,Sensitive Locators,,The test uses element identification selectors that have long chains to identify an element in the user interface. e.g. complex x-pass or CSS selector for web application.,FALSO,VERDADEIRO,VERDADEIRO
https://codingcraftsman.wordpress.com/2018/09/27/test-smells/,Test Smells - The Coding Craftsman,webpage,Test Smell,Share the world,,"where the test sets up all its resources at the start of the fixture, leading to either bleeding of state between tests, or extra work to keep things tidy",FALSO,FALSO,FALSO
https://link.springer.com/article/10.1007/s10009-008-0075-0,An approach to quality engineering of TTCN-3 test specifications,article,Test Smell,Short template,,the body of a template definition is so short that it does not justify the creation of a template declaration.,FALSO,FALSO,FALSO
https://link.springer.com/chapter/10.1007/978-3-540-73066-8_16,Utilising Code Smells to Detect Quality Problems in TTCN-3 Test Suites,paper,Test Smell,Short Template,,A template definition is very short,FALSO,FALSO,VERDADEIRO
https://ieeexplore.ieee.org/abstract/document/6299294,Bad smells and refactoring methods for GUI test script,paper,Test Smell,Shotgun Surgery,,Multiple places need to be modified with a single change.,FALSO,FALSO,FALSO
https://link.springer.com/article/10.1007/s10009-008-0075-0,An approach to quality engineering of TTCN-3 test specifications,article,Test Smell,Singular component variable/constant/timer reference,,"a component variable, constant, or timer is referenced by one single function, test case, or altstep only, although other behavioural entities run on the component as well",FALSO,FALSO,FALSO
https://link.springer.com/chapter/10.1007/978-3-540-73066-8_16,Utilising Code Smells to Detect Quality Problems in TTCN-3 Test Suites,paper,Test Smell,Singular Component Variable/Constant/Timer Reference,,"A component variable, constant, or timer is referenced by one single function, test case, or altstep only, although other behaviour runs on the component as well",FALSO,FALSO,VERDADEIRO
https://link.springer.com/chapter/10.1007/978-3-540-73066-8_16,Utilising Code Smells to Detect Quality Problems in TTCN-3 Test Suites,paper,Test Smell,Singular Template Reference,,A template definition is referenced only once,FALSO,FALSO,VERDADEIRO
https://link.springer.com/article/10.1007/s10009-008-0075-0,An approach to quality engineering of TTCN-3 test specifications,article,Test Smell,Singulartemplate reference,,a template definition is referenced only once.,FALSO,FALSO,FALSO
https://citeseerx.ist.psu.edu/viewdoc/download?doi=10.1.1.696.5180&rep=rep1&type=pdf,Categorising Test Smells,thesis,Test Smell,Skip-Epidemic,,Failing tests are constantly skipped over.,FALSO,FALSO,VERDADEIRO
https://dl.acm.org/doi/10.1145/3387940.3392189,An Exploratory Study on the Refactoring of Unit Test Files in Android Applications,paper,Test Smell,Sleepy Test,,A test method that invokes the Thread.sleep() method,FALSO,FALSO,FALSO
https://dl.acm.org/doi/10.1145/3474624.3477066,Handling Test Smells in Python: Results from a Mixed-Method Study,paper,Test Smell,Sleepy Test,,Test method with pauses to wait for an event,FALSO,FALSO,FALSO
https://dl.acm.org/doi/abs/10.1145/3379597.3387453,Investigating Severity Thresholds for Test Smells,paper,Test Smell,Sleepy Test,,A test which contains thread suspension calls,FALSO,FALSO,FALSO
https://dl.acm.org/doi/10.1145/3482909.3482915,Investigating Test Smells in JavaScript Test Code,paper,Test Smell,Sleepy Test,,"A test that makes a thread to sleep, which can lead to undesirable behavior such as race conditions",FALSO,FALSO,VERDADEIRO
https://ieeexplore.ieee.org/document/9463091,"On the Distribution of ""Simple Stupid Bugs"" in Unit Test Files: An Exploratory Study",paper,Test Smell,Sleepy Test,,A test method that invokes the Thread.sleep() method,FALSO,FALSO,FALSO
https://dl.acm.org/doi/10.1145/3350768.3350775,On the influence of Test Smells on Test Coverage,paper,Test Smell,Sleepy Test,,"Occurs when the execution of statements in a test method needs to be paused for a certain amount of time (e.g., simulating an external event) and, after that, it continues with the execution",FALSO,FALSO,FALSO
https://dl.acm.org/doi/abs/10.1145/3482909.3482916,On the use of test smells for prediction of flaky tests,paper,Test Smell,Sleepy Test,,A test method that invokes the Thread.sleep() method.,FALSO,VERDADEIRO,VERDADEIRO
https://ieeexplore.ieee.org/document/9678615/,PyNose: A Test Smell Detector For Python,paper,Test Smell,Sleepy Test,,"Occurs when developers need to pause the execution of statements in a test case for a certain duration (i.e., simulate an external event) and then continue with the execution",FALSO,VERDADEIRO,VERDADEIRO
https://dl.acm.org/doi/10.1145/3463274.3463335,Test Smell Detection Tools: A Systematic Mapping Study,paper,Test Smell,Sleepy Test,,Occurs when a test method has an explicit wait.,FALSO,FALSO,FALSO
https://link.springer.com/article/10.1007/s10664-021-09969-1,The secret life of test smells-an empirical study on test smell evolution and maintenance,article,Test Smell,Sleepy Test,,"Occurs when explicitly making a thread to sleep in test cases, which may cause flaky test results.",FALSO,FALSO,VERDADEIRO
https://dl.acm.org/doi/10.1145/3368089.3417921,tsDetect: an open source test smells detection tool,paper,Test Smell,Sleepy Test,,A test method that invokes the Thread.sleep() method,FALSO,FALSO,FALSO
https://citeseerx.ist.psu.edu/viewdoc/download?doi=10.1.1.696.5180&rep=rep1&type=pdf,Categorising Test Smells,thesis,Test Smell,Sloppy Worker,Wet Floor,The test generates data but it omits dispensing with the data after finishing. This will cause itself and other tests to fail on consecutive runs.,FALSO,FALSO,VERDADEIRO
https://books.google.com.br/books?hl=pt-BR&lr=&id=-izOiCEIABQC&oi=fnd&pg=PT19&dq=%22test+code%22+AND+(%22test*+smell*%22+OR+antipattern*+OR+%22poor+quality%22)&ots=YL71coYZkx&sig=s3U1TNqypvSAzSilSbex5lnHonk#v=onepage&q=%22test%20code%22%20AND%20(%22test*%20smell*%22%20OR%20antipattern*%20OR%20%22poor%20quality%22)&f=false,xUnit test patterns: Refactoring test code,book,Test Smell,Slow Component Usage,,A component of the SUT has high latency.,FALSO,VERDADEIRO,FALSO
https://dzone.com/articles/unit-testing-smells-what-are-your-tests-telling-yo,Unit Testing Smells: What Are Your Tests Telling You?,webpage,Test Smell,Slow Running Tests,,"If you have unit tests that take tens of milliseconds or more to run, you have a smell.",FALSO,VERDADEIRO,FALSO
https://citeseerx.ist.psu.edu/viewdoc/download?doi=10.1.1.696.5180&rep=rep1&type=pdf,Categorising Test Smells,thesis,Test Smell,Slow Test,"Long Running Test, The Slow Poke",The test runs too slowly.,FALSO,FALSO,VERDADEIRO
https://dl.acm.org/doi/abs/10.5555/1768961.1768982,Inspecting Automated Test Code: A Preliminary Study,paper,Test Smell,Slow test,,The test takes so long that developers avoid to run it every time they make a change,FALSO,FALSO,VERDADEIRO
http://j.mecs-press.net/ijitcs/ijitcs-v7-n3/IJITCS-V7-N3-8.pdf,Investigating into Automated Test Patterns in Erratic Tests by Considering Complex Objects,article,Test Smell,Slow Test,,"Slow tests are kind of tests which take long enough to run. This explains why when test developers make a change to the SUT, they don't execute tests every time.",FALSO,VERDADEIRO,FALSO
https://ieeexplore.ieee.org/document/8501942,What We Know About Smells in Software Test Code,technical paper/manuscript,Test Smell,Slow test,,The test takes too long (time) to run.,FALSO,FALSO,FALSO
https://books.google.com.br/books?hl=pt-BR&lr=&id=-izOiCEIABQC&oi=fnd&pg=PT19&dq=%22test+code%22+AND+(%22test*+smell*%22+OR+antipattern*+OR+%22poor+quality%22)&ots=YL71coYZkx&sig=s3U1TNqypvSAzSilSbex5lnHonk#v=onepage&q=%22test%20code%22%20AND%20(%22test*%20smell*%22%20OR%20antipattern*%20OR%20%22poor%20quality%22)&f=false,xUnit test patterns: Refactoring test code,book,Test Smell,Slow Test,,The tests take too long to run,FALSO,VERDADEIRO,FALSO
https://orbilu.uni.lu/handle/10993/48254,On the Maintenance of System User Interactive Tests,thesis,Test Smell,Sneaky Checking,,The test hides its assertions in actions that are at the wrong level of details.,FALSO,VERDADEIRO,VERDADEIRO
https://arxiv.org/abs/2111.02317,Smells in System User Interactive Tests,technical paper/manuscript,Test Smell,Sneaky Checking,,The test hides its assertions in actions that are at the wrong level of details.,FALSO,VERDADEIRO,VERDADEIRO
https://www.techwell.com/techwell-insights/2015/09/test-design-automation-anti-patterns,Test design for automation: Anti-patterns,webpage,Test Smell,Sneaky Checking,,The test hides its assertions in actions that are at the wrong level of details.,FALSO,FALSO,FALSO
https://codingcraftsman.wordpress.com/2018/09/27/test-smells/,Test Smells - The Coding Craftsman,webpage,Test Smell,So the Automation Tool Wrote This Crap,,"where the code of the test was ejected out of the guts of a code-generator built from a test GUI. This may not be a real issue, if the code isn’t then modified and updated. However, if this code is actively developed, then de-robotise it.",FALSO,FALSO,FALSO
https://orbilu.uni.lu/handle/10993/48254,On the Maintenance of System User Interactive Tests,thesis,Test Smell,Stinky Synchronization,,The test fails to use proper synchronization points with the system under test,FALSO,VERDADEIRO,VERDADEIRO
https://arxiv.org/abs/2111.02317,Smells in System User Interactive Tests,technical paper/manuscript,Test Smell,Stinky Synchronization,,The test fails to use proper synchronization points with the system under test,FALSO,VERDADEIRO,VERDADEIRO
https://www.sciencedirect.com/science/article/abs/pii/S0164121217303060,Smells in software test code: A survey of knowledge in industry and academia,article,Test Smell,Stinky synchronization syndrome,,The failure to use proper synchronization/wait points in the GUI-based testing of web applications using tools such as Selenium.,FALSO,FALSO,FALSO
https://link.springer.com/article/10.1007/s10009-008-0075-0,An approach to quality engineering of TTCN-3 test specifications,article,Test Smell,Stop in function,,a function contains a stop statement,FALSO,FALSO,FALSO
https://link.springer.com/chapter/10.1007/978-3-540-73066-8_16,Utilising Code Smells to Detect Quality Problems in TTCN-3 Test Suites,paper,Test Smell,Stop in Function,,A function contains a stop statement,FALSO,FALSO,FALSO
https://wiki.c2.com/?SubclassToTestAntiPattern,Subclass To Test Anti Pattern,webpage,Anti-pattern,Subclass To Test,,"Need to fake, mock or stub methods in a ClassUnderTest, and/or classes it uses.",FALSO,VERDADEIRO,FALSO
https://digitaltapestry.net/testify/manual/AntiPatterns.html,Anti-Patterns - Digital Tapestry,webpage,Anti-pattern,Success Against All Odds,,"A test that was written to pass first rather than fail first. As an unfortunate side effect, the test case happens to always pass even though the test should fail.",FALSO,FALSO,FALSO
https://citeseerx.ist.psu.edu/viewdoc/download?doi=10.1.1.696.5180&rep=rep1&type=pdf,Categorising Test Smells,thesis,Test Smell,Success Against All Odds,,The tests are written first but they are written in a way that they pass first rather than failing in the first execution.,FALSO,FALSO,VERDADEIRO
https://bryanwilhite.github.io/the-funky-knowledge-base/entry/kb2076072213/,Test-Driven Development: TDD Anti-Patterns,webpage,Anti-pattern,Success Against All Odds,,"A test that was written pass first rather than fail first. As an unfortunate side effect, the test case happens to always pass even though the test should fail.",FALSO,FALSO,FALSO
https://www.codementor.io/@mgawinecki/anti-patterns-in-test-automation-101c6vm5jz,Anti-patterns in test automation,webpage,Anti-pattern,Taking environment state for granted,,"Taking environment state for granted is often over optimistic. Unlike in unit tests, end-to-end setup gives little control over test environment state, particularly when it is shared with other teams. When the test starts failing it might be because of a new bug introduced or because environment is not in a state your test needs.",FALSO,FALSO,FALSO
http://citeseerx.ist.psu.edu/viewdoc/download?doi=10.1.1.108.3631&rep=rep1&type=pdf,Rule-based Assessment of Test Quality,article,Test Smell,Teardown Only Test,,Test-suite only dening teardown (unusual for unit tests),FALSO,FALSO,VERDADEIRO
https://dl.acm.org/doi/10.1145/3463274.3463335,Test Smell Detection Tools: A Systematic Mapping Study,paper,Test Smell,Teardown Only Test,,Exists when a test-suite is only specifying teardown,FALSO,FALSO,FALSO
https://completedeveloperpodcast.com/anti-patterns-in-unit-testing/,Anti-Patterns In Unit Testing,webpage,Anti-pattern,Test cases are concerned with more than one unit of code,,When tests get too big they can have bugs of their own,FALSO,FALSO,FALSO
https://ieeexplore.ieee.org/abstract/document/7181438/,Generating refactoring proposals to remove clones from automated system tests,paper,Test Smell,Test Clones,,"Tests contain similar parts (e. g., introduced by copy&paste)",FALSO,FALSO,FALSO
https://ieeexplore.ieee.org/abstract/document/6606682,Hunting for smells in natural language tests,paper,Test Smell,Test Clones,,"Tests contain similar parts (e. g., introduced by copy&paste)",FALSO,VERDADEIRO,VERDADEIRO
https://arxiv.org/abs/2003.05613,A survey on test practitioners' awareness of test smells,paper,Test Smell,Test Code Duplication,,Occurs when test code has undesired duplication,FALSO,FALSO,FALSO
https://ieeexplore.ieee.org/document/6405253,An empirical analysis of the distribution of unit test smells and their impact on software maintenance,paper,Test Smell,Test Code Duplication,,Code clones contained inside the unit tests,FALSO,FALSO,FALSO
https://ieeexplore.ieee.org/abstract/document/8847402/,An exploratory study of the relationship between software test smells and fault-proneness,article,Test Smell,Test Code Duplication,,Code clones contained inside the unit tests,FALSO,FALSO,VERDADEIRO
https://link.springer.com/article/10.1007/s10664-014-9313-0,Are test smells really harmful? An empirical study,article,Test Smell,Test Code Duplication,,Code clones contained inside the unit tests,FALSO,VERDADEIRO,VERDADEIRO
https://citeseerx.ist.psu.edu/viewdoc/download?doi=10.1.1.696.5180&rep=rep1&type=pdf,Categorising Test Smells,thesis,Test Smell,Test Code Duplication,Second Class Citizen,The test code is duplicated several times. This is either done on purpose by copying and pasting the code or the same code is unintentionally written again.,FALSO,FALSO,VERDADEIRO
https://dl.acm.org/doi/10.1145/3379597.3387471,Did You Remember To Test Your Tokens?,paper,Test Smell,Test Code Duplication,,"In this smell, the same test code is repeated many times [26]. Duplicated code impacts test code maintenance [20], which can be a serious issue: if test logic in on code fragments is modified, all duplicates must be identified & modified as well.",FALSO,VERDADEIRO,FALSO
https://lutpub.lut.fi/handle/10024/158751,Enhancing developers’ awareness on test suites’ quality with test smell summaries,thesis,Test Smell,Test Code Duplication,,"Replication of the test code many times. The necessity of performing similiar things by various tests in a suite, often results in Test Code Duplication, for instance, tests may need similar fixture setup or result verification logic",FALSO,FALSO,FALSO
https://dl.acm.org/doi/abs/10.5555/1768961.1768982,Inspecting Automated Test Code: A Preliminary Study,paper,Test Smell,Test code duplication,,Identical fragments of test code (clones) appear in a number of test cases,FALSO,FALSO,VERDADEIRO
https://dl.acm.org/doi/10.1145/2897010.2897016,On the diffusion of test smells in automatically generated test code: an empirical study,paper,Test Smell,Test Code Duplication,,"Code duplication is a potentially serious problem that affects the maintainability and the comprehensibility of a software system. In test classes, the most common case in which this smell appears is the duplication of code in the same test class.",FALSO,FALSO,FALSO
https://link.springer.com/chapter/10.1007/978-3-540-76440-3_8,On the interplay between software testing and evolution and its effect on program comprehension,article,Test Smell,Test Code Duplication,,"Test code may contain undesirable duplication. In particular the parts that set up test fixtures are susceptible to this problem. Solutions are similar to those for normal code duplication as described by Fowler [183, p. 76]. The most common case for test code will be duplication of code in the same test class.",FALSO,VERDADEIRO,FALSO
https://citeseerx.ist.psu.edu/viewdoc/download?doi=10.1.1.19.5499&rep=rep1&type=pdf,Refactoring Test Code,paper,Test Smell,Test Code Duplication,,Test code may contain undesirable duplication. In particular the parts that set up test fixtures are susceptible to this problem.,FALSO,VERDADEIRO,FALSO
https://ieeexplore.ieee.org/abstract/document/6862882/,Test code quality and its relation to issue handling performance,article,Test Smell,Test Code Duplication,,Occurs when copy-paste is used as a way to reuse test logic.,FALSO,FALSO,FALSO
https://dl.acm.org/doi/10.1145/3463274.3463335,Test Smell Detection Tools: A Systematic Mapping Study,paper,Test Smell,Test Code Duplication,,Occurs when code clones contained inside the test,FALSO,FALSO,FALSO
https://books.google.com.br/books?hl=pt-BR&lr=&id=-izOiCEIABQC&oi=fnd&pg=PT19&dq=%22test+code%22+AND+(%22test*+smell*%22+OR+antipattern*+OR+%22poor+quality%22)&ots=YL71coYZkx&sig=s3U1TNqypvSAzSilSbex5lnHonk#v=onepage&q=%22test%20code%22%20AND%20(%22test*%20smell*%22%20OR%20antipattern*%20OR%20%22poor%20quality%22)&f=false,xUnit test patterns: Refactoring test code,book,Test Smell,Test Dependency in Production,,Production executables depend on test executables.,FALSO,VERDADEIRO,FALSO
https://citeseerx.ist.psu.edu/viewdoc/download?doi=10.1.1.696.5180&rep=rep1&type=pdf,Categorising Test Smells,thesis,Test Smell,Test Envy,,The test tests another class instead of the one it is supposed to test.,FALSO,FALSO,VERDADEIRO
