Reference Title,Title,Source Type,AP/TS,Name,AKA,Definition,Code Example,Causes / Effects,Frequency
https://www.proquest.com/openview/17433ac63caf619abb410e441e6557f0/1?pq-origsite=gscholar&cbl=18750,What the Smell? An Empirical Investigation on the Distribution and Severity of Test Smells in Open Source Android Applications,thesis,Test Smell,Lazy Test,,Occurs when multiple test methods invoke the same method of the production object,FALSO,FALSO,VERDADEIRO
http://citeseerx.ist.psu.edu/viewdoc/download?doi=10.1.1.108.3631&rep=rep1&type=pdf,Rule-based Assessment of Test Quality,article,Test Smell,Likely ineffective Object-Comparison,,Objects comparisons which can never fail,FALSO,FALSO,VERDADEIRO
https://dl.acm.org/doi/10.1145/3463274.3463335,Test Smell Detection Tools: A Systematic Mapping Study,paper,Test Smell,Likely Ineffective Object-Comparison,,A test that performs a comparison between objects will never fail.,FALSO,FALSO,FALSO
https://stackoverflow.com/questions/333682/unit-testing-anti-patterns-catalogue,Unit testing Anti-patterns catalogue,webpage,Anti-pattern,Line hitter,,"On the first look tests covers everything and code coverage tools confirms it with 100%, but in reality tests only hit code without any output analyses.",FALSO,FALSO,FALSO
https://www.yegor256.com/2018/12/11/unit-testing-anti-patterns.html,"Unit Testing Anti-Patterns, Full List",webpage,Anti-pattern,Line hitter,,"At first glance, the tests cover everything and code coverage tools confirm it with 100%, but in reality the tests merely hit the code, without doing any output analysis.",FALSO,FALSO,FALSO
https://citeseerx.ist.psu.edu/viewdoc/download?doi=10.1.1.696.5180&rep=rep1&type=pdf,Categorising Test Smells,thesis,Test Smell,Lonely Test,,The test can only be run in a collection of tests (test suite) but not on its own since it depends on the shared fixture of another test in the collection.,FALSO,FALSO,VERDADEIRO
https://books.google.com.br/books?hl=pt-BR&lr=&id=-izOiCEIABQC&oi=fnd&pg=PT19&dq=%22test+code%22+AND+(%22test*+smell*%22+OR+antipattern*+OR+%22poor+quality%22)&ots=YL71coYZkx&sig=s3U1TNqypvSAzSilSbex5lnHonk#v=onepage&q=%22test%20code%22%20AND%20(%22test*%20smell*%22%20OR%20antipattern*%20OR%20%22poor%20quality%22)&f=false,xUnit test patterns: Refactoring test code,book,Test Smell,Lonely Test,,Lonely Test is a special case of Interacting Tests in which a test can be run as part of a suite but cannot be run by itself because it depends on something in a Shared Fixture that was created by another test (e.g. Chained Tests (page X)) or by suite-level fixture setup logic (such as a Setup Decorator.),FALSO,VERDADEIRO,FALSO
https://techbeacon.com/app-dev-testing/7-ways-tidy-your-test-code,Writing good gherkin,webpage,Test Smell,Long class,,"To properly execute your automated test, your code must open your application in a browser, perform the necessary actions on the application, and then verify the resulting state of the application. While these are all needed for your test, these are different responsibilities, and having all of these responsibilities together within a single class is a code smell. This smell makes it difficult to grasp the entirety of what's contained within the class, which can lead to redundancy and maintenance challenges.",FALSO,VERDADEIRO,FALSO
http://citeseerx.ist.psu.edu/viewdoc/download?doi=10.1.1.115.3594&rep=rep1&type=pdf,A Refactoring Tool for TTCN-3,thesis,Test Smell,Long Function,Long Method,Long functions are hard to understand and indirection can be better supported by small functions,FALSO,FALSO,FALSO
https://ieeexplore.ieee.org/abstract/document/6299294,Bad smells and refactoring methods for GUI test script,paper,Test Smell,Long Macro Event,Long Keyword,A macro event (or keyword) contains too many actions.,FALSO,FALSO,FALSO
https://techbeacon.com/app-dev-testing/7-ways-tidy-your-test-code,Writing good gherkin,webpage,Test Smell,Long method,,"It's where a method or function has too many responsibilities. Many times a method does not start off being too long, but over time it grows and grows, taking on additional responsibilities. This poses an issue when tests want to call into a method to do one thing, but will ultimately have multiple other things executed as well.",FALSO,VERDADEIRO,FALSO
http://citeseerx.ist.psu.edu/viewdoc/download?doi=10.1.1.115.3594&rep=rep1&type=pdf,A Refactoring Tool for TTCN-3,thesis,Test Smell,Long Parameter List,,"Long parameter lists are hard to understand, become inconsistent and difficult to use as they are always changed when more data is needed",FALSO,FALSO,FALSO
https://link.springer.com/article/10.1007/s10009-008-0075-0,An approach to quality engineering of TTCN-3 test specifications,article,Test Smell,Long parameter list,,the number of formal parameters is high,FALSO,FALSO,FALSO
https://ieeexplore.ieee.org/abstract/document/6299294,Bad smells and refactoring methods for GUI test script,paper,Test Smell,Long Parameter List,,The parameter list of a keyword or macro event is too long; it is difficult to understand the meaning of each parameter.,FALSO,FALSO,FALSO
https://link.springer.com/chapter/10.1007/978-3-540-73066-8_16,Utilising Code Smells to Detect Quality Problems in TTCN-3 Test Suites,paper,Test Smell,Long Parameter List,,The number of formal parameters is high,FALSO,FALSO,FALSO
https://jakescruggs.blogspot.com/2009/04/smells-of-testing-signs-your-tests-are.html,Smells of Testing (signs your tests are bad),webpage,Test Smell,Long Running Tests,,"When the feedback loop of code, test, code gets too long it can encourage bad behavior.",FALSO,FALSO,FALSO
https://link.springer.com/article/10.1007/s10009-008-0075-0,An approach to quality engineering of TTCN-3 test specifications,article,Test Smell,Long statement block,,"a function, test case, or altstep has a long statement block.",FALSO,FALSO,FALSO
https://link.springer.com/chapter/10.1007/978-3-540-73066-8_16,Utilising Code Smells to Detect Quality Problems in TTCN-3 Test Suites,paper,Test Smell,Long Statement Block,,"A function, test case, or altstep has a long statement block",FALSO,FALSO,FALSO
https://citeseerx.ist.psu.edu/viewdoc/download?doi=10.1.1.696.5180&rep=rep1&type=pdf,Categorising Test Smells,thesis,Test Smell,Long Test,"Obscure Test, Verbose Test, Complex Test","The test is too long in general and thus, is complicated to understand.",FALSO,FALSO,VERDADEIRO
http://citeseerx.ist.psu.edu/viewdoc/download?doi=10.1.1.108.3631&rep=rep1&type=pdf,Rule-based Assessment of Test Quality,article,Test Smell,Long Test,,Tests including too many statements,FALSO,FALSO,VERDADEIRO
https://dl.acm.org/doi/10.1145/3463274.3463335,Test Smell Detection Tools: A Systematic Mapping Study,paper,Test Smell,Long Test,,A test with many statements.,FALSO,FALSO,FALSO
https://ieeexplore.ieee.org/abstract/document/6606682,Hunting for smells in natural language tests,paper,Test Smell,Long Test Steps,,A test step is very long,FALSO,VERDADEIRO,VERDADEIRO
https://orbilu.uni.lu/handle/10993/48254,On the Maintenance of System User Interactive Tests,thesis,Test Smell,Long Test Steps,,"One or many test steps are very long, performing a lot of actions on the system under test.",FALSO,VERDADEIRO,VERDADEIRO
https://arxiv.org/abs/2111.02317,Smells in System User Interactive Tests,technical paper/manuscript,Test Smell,Long Test Steps,,"One or many test steps are very long, performing a lot of actions on the system under test.",FALSO,VERDADEIRO,VERDADEIRO
https://ieeexplore.ieee.org/document/8501942,What We Know About Smells in Software Test Code,technical paper/manuscript,Test Smell,Long/complex/verbose/obscure test,,It is difficult to understand the test at a glance. The test usually has excessive lines of code.,FALSO,FALSO,FALSO
https://books.google.com.br/books?hl=pt-BR&lr=&id=-izOiCEIABQC&oi=fnd&pg=PT19&dq=%22test+code%22+AND+(%22test*+smell*%22+OR+antipattern*+OR+%22poor+quality%22)&ots=YL71coYZkx&sig=s3U1TNqypvSAzSilSbex5lnHonk#v=onepage&q=%22test%20code%22%20AND%20(%22test*%20smell*%22%20OR%20antipattern*%20OR%20%22poor%20quality%22)&f=false,xUnit test patterns: Refactoring test code,book,Test Smell,Lost Test,,The number of tests being executed in a test suite has dropped (or has not increased as much as expected). We may notice this directly if we are paying attention to test counts or we may find a bug that should have been caused by a test that we know exists but upon poking around we discover that the test has been disabled.,FALSO,VERDADEIRO,FALSO
https://dl.acm.org/doi/10.1145/3350768.3350775,On the influence of Test Smells on Test Coverage,paper,Test Smell,Magic Number,,Occurs when assert statements contain numeric literals,FALSO,FALSO,FALSO
https://arxiv.org/abs/2003.05613,A survey on test practitioners' awareness of test smells,paper,Test Smell,Magic Number Test,,Occurs when tests present a literal number as a test parameter,FALSO,FALSO,FALSO
https://dl.acm.org/doi/10.1145/3387940.3392189,An Exploratory Study on the Refactoring of Unit Test Files in Android Applications,paper,Test Smell,Magic Number Test,,An assertion method that contains a numeric literal as an argument,FALSO,FALSO,FALSO
https://dl.acm.org/doi/10.1145/3474624.3477066,Handling Test Smells in Python: Results from a Mixed-Method Study,paper,Test Smell,Magic Number Test,,Test Method that contains some number without indicating their purpose,FALSO,FALSO,FALSO
https://dl.acm.org/doi/abs/10.1145/3379597.3387453,Investigating Severity Thresholds for Test Smells,paper,Test Smell,Magic Number Test,,"A test that contains so-called “magic numbers”, which are numbers used in assertions without any explanation where they come from and their value may not be immediately clear from just looking at the test code",FALSO,FALSO,FALSO
https://dl.acm.org/doi/10.1145/3482909.3482915,Investigating Test Smells in JavaScript Test Code,paper,Test Smell,Magic Number Test,,Assert statements in a test method contains numeric literals as parameters that may not provide their meaning,FALSO,FALSO,VERDADEIRO
https://ieeexplore.ieee.org/document/9463091,"On the Distribution of ""Simple Stupid Bugs"" in Unit Test Files: An Exploratory Study",paper,Test Smell,Magic Number Test,,An assertion method that contains a numeric literal as an argument,FALSO,FALSO,FALSO
https://dl.acm.org/doi/abs/10.1145/3482909.3482916,On the use of test smells for prediction of flaky tests,paper,Test Smell,Magic Number Test,,An assertion method that contains a numeric literal as an argument.,FALSO,VERDADEIRO,VERDADEIRO
https://ieeexplore.ieee.org/document/9678615/,PyNose: A Test Smell Detector For Python,paper,Test Smell,Magic Number Test,,"Occurs when assert statements in a test case contain numeric literals (i.e., magic numbers) as parameters instead of more descriptive constants or variables",FALSO,VERDADEIRO,VERDADEIRO
https://dl.acm.org/doi/10.1145/3463274.3463335,Test Smell Detection Tools: A Systematic Mapping Study,paper,Test Smell,Magic Number Test,,A test method that contains undocumented numerical values,FALSO,FALSO,FALSO
https://link.springer.com/article/10.1007/s10664-021-09969-1,The secret life of test smells-an empirical study on test smell evolution and maintenance,article,Test Smell,Magic Number Test,,"A test method contains unexplained and undocumented numeric literals as parameters or identifiers, which increases maintenance difficulty.",FALSO,FALSO,VERDADEIRO
https://dl.acm.org/doi/10.1145/3368089.3417921,tsDetect: an open source test smells detection tool,paper,Test Smell,Magic Number Test,,An assertion method that contains a numeric literal as an argument,FALSO,FALSO,FALSO
https://link.springer.com/article/10.1007/s10009-008-0075-0,An approach to quality engineering of TTCN-3 test specifications,article,Test Smell,Magic values,,"magic values are literals that are not defined as constants or as part of templates. Numeric literals are called Magic Numbers, string literals are called Magic Strings",FALSO,FALSO,FALSO
https://link.springer.com/chapter/10.1007/978-3-540-73066-8_16,Utilising Code Smells to Detect Quality Problems in TTCN-3 Test Suites,paper,Test Smell,Magic Values,,A literal is not defined as a TTCN-3 constant,FALSO,FALSO,VERDADEIRO
https://codingcraftsman.wordpress.com/2018/09/27/test-smells/,Test Smells - The Coding Craftsman,webpage,Test Smell,Making a mockery of design,,where pure functions have to be dependency injected so they can be mocked.,FALSO,FALSO,FALSO
https://exubero.com/junit/anti-patterns/,JUnit Anti-patterns,webpage,Anti-pattern,Manual Assertions,,Manual assertions describes the scenarios where the JUnit assert or fail methods are ignored in favour of other methods confirming program accuracy.,FALSO,FALSO,FALSO
https://citeseerx.ist.psu.edu/viewdoc/download?doi=10.1.1.696.5180&rep=rep1&type=pdf,Categorising Test Smells,thesis,Test Smell,Manual Event Injection,,"During the execution of the test, a manual action must be performed so that the test can proceed",FALSO,FALSO,VERDADEIRO
https://books.google.com.br/books?hl=pt-BR&lr=&id=-izOiCEIABQC&oi=fnd&pg=PT19&dq=%22test+code%22+AND+(%22test*+smell*%22+OR+antipattern*+OR+%22poor+quality%22)&ots=YL71coYZkx&sig=s3U1TNqypvSAzSilSbex5lnHonk#v=onepage&q=%22test%20code%22%20AND%20(%22test*%20smell*%22%20OR%20antipattern*%20OR%20%22poor%20quality%22)&f=false,xUnit test patterns: Refactoring test code,book,Test Smell,Manual Event Injection,,A person must intervene during test execution to perform some manual action before the test can proceed.,FALSO,VERDADEIRO,FALSO
https://citeseerx.ist.psu.edu/viewdoc/download?doi=10.1.1.696.5180&rep=rep1&type=pdf,Categorising Test Smells,thesis,Test Smell,Manual Fixture Setup,,"In advance of running the test, a manual setup of the test environment must be done",FALSO,FALSO,VERDADEIRO
https://books.google.com.br/books?hl=pt-BR&lr=&id=-izOiCEIABQC&oi=fnd&pg=PT19&dq=%22test+code%22+AND+(%22test*+smell*%22+OR+antipattern*+OR+%22poor+quality%22)&ots=YL71coYZkx&sig=s3U1TNqypvSAzSilSbex5lnHonk#v=onepage&q=%22test%20code%22%20AND%20(%22test*%20smell*%22%20OR%20antipattern*%20OR%20%22poor%20quality%22)&f=false,xUnit test patterns: Refactoring test code,book,Test Smell,Manual Fixture Setup,,"A person has to set up the test environment manually before the automated tests can be run. This may take the form of configuring servers, starting server processes or running scripts to set up a Prebuilt Fixture",FALSO,VERDADEIRO,FALSO
https://citeseerx.ist.psu.edu/viewdoc/download?doi=10.1.1.696.5180&rep=rep1&type=pdf,Categorising Test Smells,thesis,Test Smell,Manual Intervention,"Interactive Test, Manual Testing, Manual Test",The test requires a manual action by the developer.,FALSO,FALSO,VERDADEIRO
https://dl.acm.org/doi/abs/10.5555/1768961.1768982,Inspecting Automated Test Code: A Preliminary Study,paper,Test Smell,Manual intervention,,"A test case requires manual changes before the test is run, otherwise the test fails",FALSO,FALSO,VERDADEIRO
https://books.google.com.br/books?hl=pt-BR&lr=&id=-izOiCEIABQC&oi=fnd&pg=PT19&dq=%22test+code%22+AND+(%22test*+smell*%22+OR+antipattern*+OR+%22poor+quality%22)&ots=YL71coYZkx&sig=s3U1TNqypvSAzSilSbex5lnHonk#v=onepage&q=%22test%20code%22%20AND%20(%22test*%20smell*%22%20OR%20antipattern*%20OR%20%22poor%20quality%22)&f=false,xUnit test patterns: Refactoring test code,book,Test Smell,Manual Intervention,,A test requires a person to perform some manual action each time it is run.,FALSO,VERDADEIRO,FALSO
https://citeseerx.ist.psu.edu/viewdoc/download?doi=10.1.1.696.5180&rep=rep1&type=pdf,Categorising Test Smells,thesis,Test Smell,Manual Result Verification,,"The results are manually verified and therefore, the tests even pass if the production code returns wrong results",FALSO,FALSO,VERDADEIRO
https://books.google.com.br/books?hl=pt-BR&lr=&id=-izOiCEIABQC&oi=fnd&pg=PT19&dq=%22test+code%22+AND+(%22test*+smell*%22+OR+antipattern*+OR+%22poor+quality%22)&ots=YL71coYZkx&sig=s3U1TNqypvSAzSilSbex5lnHonk#v=onepage&q=%22test%20code%22%20AND%20(%22test*%20smell*%22%20OR%20antipattern*%20OR%20%22poor%20quality%22)&f=false,xUnit test patterns: Refactoring test code,book,Test Smell,Manual Result Verification,,We can run the tests but they almost always pass even when we know that the SUT is not returning the correct results.,FALSO,VERDADEIRO,FALSO
https://jakescruggs.blogspot.com/2009/04/smells-of-testing-signs-your-tests-are.html,Smells of Testing (signs your tests are bad),webpage,Test Smell,Many Assertions,,When a test tests way too much its failure is often hard to track down.,FALSO,FALSO,FALSO
https://codingcraftsman.wordpress.com/2018/09/27/test-smells/,Test Smells - The Coding Craftsman,webpage,Test Smell,Martini Assertion,,"where we look for the desired outcome anytime, any place, anywhere – often caused by Celery Data and in some ways the opposite of the Equality Sledgehammer. Rather than look at a specific field to see if it’s right, we look for some data in the WHOLE output.",FALSO,FALSO,FALSO
http://citeseerx.ist.psu.edu/viewdoc/download?doi=10.1.1.108.3631&rep=rep1&type=pdf,Rule-based Assessment of Test Quality,article,Test Smell,Max Instance Variables,,Large or oversized xture,FALSO,FALSO,VERDADEIRO
https://dl.acm.org/doi/10.1145/3463274.3463335,Test Smell Detection Tools: A Systematic Mapping Study,paper,Test Smell,Max Instance Variables,,A test method that has a large fixture,FALSO,FALSO,FALSO
https://ieeexplore.ieee.org/abstract/document/6299294,Bad smells and refactoring methods for GUI test script,paper,Test Smell,Middle Man,,A macro component delegates all its tasks to another macro component,FALSO,FALSO,FALSO
https://orbilu.uni.lu/handle/10993/48254,On the Maintenance of System User Interactive Tests,thesis,Test Smell,Middle Man,,"A test component (keyword, macro, function) delegates all its tasks to another test component.",FALSO,VERDADEIRO,VERDADEIRO
https://arxiv.org/abs/2111.02317,Smells in System User Interactive Tests,technical paper/manuscript,Test Smell,Middle Man,,"A test component (keyword, macro, function) delegates all its tasks to another test component.",FALSO,VERDADEIRO,VERDADEIRO
https://citeseerx.ist.psu.edu/viewdoc/download?doi=10.1.1.696.5180&rep=rep1&type=pdf,Categorising Test Smells,thesis,Test Smell,Missing Assertion Message,,"There are several assertions of the same kind which either have identical assertion methods or lack an assertion message. Thus, if one assertion fails, it is impossible to determine which one it is.",FALSO,FALSO,VERDADEIRO
https://orbilu.uni.lu/handle/10993/48254,On the Maintenance of System User Interactive Tests,thesis,Test Smell,Missing Assertions,,The test lacks any explicit assertions,FALSO,VERDADEIRO,VERDADEIRO
https://arxiv.org/abs/2111.02317,Smells in System User Interactive Tests,technical paper/manuscript,Test Smell,Missing Assertions,,The test lacks any explicit assertions,FALSO,VERDADEIRO,VERDADEIRO
https://link.springer.com/article/10.1007/s10009-008-0075-0,An approach to quality engineering of TTCN-3 test specifications,article,Test Smell,Missing log,,"setverdict is used to set verdict inconc or fail, but without calling log",FALSO,FALSO,FALSO
https://link.springer.com/chapter/10.1007/978-3-540-73066-8_16,Utilising Code Smells to Detect Quality Problems in TTCN-3 Test Suites,paper,Test Smell,Missing Log,,setverdict sets the verdict inconc or fail without calling log.,FALSO,FALSO,FALSO
https://link.springer.com/article/10.1007/s10009-008-0075-0,An approach to quality engineering of TTCN-3 test specifications,article,Test Smell,Missing variable definition,UR data flow anomaly,a variable or out parameter is read before its value has been defined,FALSO,FALSO,FALSO
https://link.springer.com/chapter/10.1007/978-3-540-73066-8_16,Utilising Code Smells to Detect Quality Problems in TTCN-3 Test Suites,paper,Test Smell,Missing Variable Definition,,A variable or out parameter is read before a value has been assigned,FALSO,FALSO,FALSO
https://link.springer.com/article/10.1007/s10009-008-0075-0,An approach to quality engineering of TTCN-3 test specifications,article,Test Smell,Missing verdict,,a test case does not set a verdict.,FALSO,FALSO,FALSO
https://link.springer.com/chapter/10.1007/978-3-540-73066-8_16,Utilising Code Smells to Detect Quality Problems in TTCN-3 Test Suites,paper,Test Smell,Missing Verdict,,A test case does not set a verdict,FALSO,FALSO,FALSO
https://codingcraftsman.wordpress.com/2018/09/27/test-smells/,Test Smells - The Coding Craftsman,webpage,Test Smell,Mistaken identity,,where the name of a test gives a contrary opinion to the meaning of the test,FALSO,FALSO,FALSO
http://citeseerx.ist.psu.edu/viewdoc/summary?doi=10.1.1.144.9594,Assessing test quality ‐ TestLint,thesis,Test Smell,Mixed Selectors,,"The problem of mixing up all the methods of a test-class is that it is harder to allocate and differentiate accessors, xtures, utilities and test-methods. By putting each type of method into a different method category, especially strictly separating test-methods from other methods we get a better structure of the test-class. A better and cleaner structure helps in understanding the test-suite, the xtures and all the test-methods.",FALSO,VERDADEIRO,FALSO
http://citeseerx.ist.psu.edu/viewdoc/download?doi=10.1.1.108.3631&rep=rep1&type=pdf,Rule-based Assessment of Test Quality,article,Test Smell,Mixed Selectors,,Violating common organizational testing conventions by mixing up testing and non-testing methods,FALSO,FALSO,VERDADEIRO
https://dl.acm.org/doi/10.1145/3463274.3463335,Test Smell Detection Tools: A Systematic Mapping Study,paper,Test Smell,Mixed Selectors,,Violates test conventions by mixing up testing and non-testing methods,FALSO,FALSO,FALSO
https://exubero.com/junit/anti-patterns/,JUnit Anti-patterns,webpage,Anti-pattern,Mixing Production and Test Code,,"Unit testing code should not really be deployed to production environments. Therefore, when packaging the code ready for release, the testing code must be somehow excluded, which can be complex depending upon the naming conventions used",FALSO,FALSO,FALSO
https://github.com/mockito/mockito/wiki/How-to-write-good-tests,How to write good tests,webpage,Anti-pattern,Mock everything,,"If everything is mocked, are we really testing the production code? Don't hesitate to not mock!",FALSO,FALSO,FALSO
https://citeseerx.ist.psu.edu/viewdoc/download?doi=10.1.1.696.5180&rep=rep1&type=pdf,Categorising Test Smells,thesis,Test Smell,Mock Happy,"Mock-Overkill, The Mockery","If one uses too many mock objects that interact with each other, the test will only test the interaction between them instead of the functionality of the production code.",FALSO,FALSO,VERDADEIRO
https://www.sciencedirect.com/science/article/abs/pii/S0164121217303060,Smells in software test code: A survey of knowledge in industry and academia,article,Test Smell,Mock Happy,,"A test that needs many mocks to run. As a result, such a test would be quite fragile, resistant to change, and hard to understand.",FALSO,FALSO,FALSO
https://jakescruggs.blogspot.com/2009/04/smells-of-testing-signs-your-tests-are.html,Smells of Testing (signs your tests are bad),webpage,Test Smell,Mock Happy,,"A test that needs 17 mocks to run can be quite fragile, resistant to change, and hard to understand.",FALSO,FALSO,FALSO
https://codingcraftsman.wordpress.com/2018/09/27/test-smells/,Test Smells - The Coding Craftsman,webpage,Test Smell,Mock madness,,"where even near-primitive values like POJOs are being mocked, just because.",FALSO,FALSO,FALSO
https://dl.acm.org/doi/10.1145/3379597.3387471,Did You Remember To Test Your Tokens?,paper,Test Smell,Mocking a Mocking Framework,,Occurrs when the test case tests the applied mocking framework,FALSO,FALSO,FALSO
https://medium.com/swlh/anti-patterns-of-automated-software-testing-b396283a4cb6,Anti-patterns of automated testing,webpage,Anti-pattern,Mocking what you don’t own,,avoid leakage of libraries into your software (runtime or external); there are alternatives like wrappers and mock servers,FALSO,FALSO,FALSO
https://github.com/mockito/mockito/wiki/How-to-write-good-tests,How to write good tests,webpage,Anti-pattern,Mocking what you don’t own,,"When mocking an external API the test cannot be used to drive the design, the API belongs to someone else ; this third party can and will change the signature and behaviour of the API.",FALSO,FALSO,FALSO
https://techbeacon.com/app-dev-testing/7-ways-tidy-your-test-code,Writing good gherkin,webpage,Test Smell,Multiple points of failure,,"Adding assertions within your framework code is a code smell. It is not this code's responsibility to determine the fate of a test. By doing so, it limits the reusability of the framework code for both negative and positive scenarios.",FALSO,VERDADEIRO,FALSO
https://completedeveloperpodcast.com/anti-patterns-in-unit-testing/,Anti-Patterns In Unit Testing,webpage,Anti-pattern,Multiple tests testing the same or similar things,,"Multiple tests are created that have the same test code, but change the values passed",FALSO,FALSO,FALSO
https://arxiv.org/abs/2003.05613,A survey on test practitioners' awareness of test smells,paper,Test Smell,Mystery Guest,,"This smell occurs when the test uses an external resource, such as a file with test data. If the external file is removed, the test results may fail;",FALSO,FALSO,FALSO
https://ieeexplore.ieee.org/document/6405253,An empirical analysis of the distribution of unit test smells and their impact on software maintenance,paper,Test Smell,Mystery Guest,,"A test uses external resources (e.g., file containing test data)",FALSO,FALSO,FALSO
